{
  "schemaVersion": 1,
  "recordId": "staging-1-0-0-4eb05ab1dc41",
  "environment": "staging",
  "phase": "deploy",
  "input": {
    "productSha": "4eb05ab1dc4121c718607c0cfcf33e8c5a269de7",
    "qualificationEvidenceSha": "ae8b1215f439fcc9c78b87f3333437e0289d8d9e",
    "topology": "candidate-b",
    "units": [
      "edge"
    ]
  },
  "startedAtUtc": "2026-08-16T11:06:58Z",
  "completedAtUtc": "2026-08-16T11:07:06Z",
  "result": "pass",
  "observations": [
    {
      "unit": "edge",
      "route": "/version",
      "status": 200,
      "contentClass": "text/plain",
      "cacheControl": "no-store",
      "workerVersionId": "0e51098f-58b8-418b-8512-29fe67db8032",
      "deploymentLabel": "edge@0e51098f-58b8-418b-8512-29fe67db8032",
      "pass": true
    },
    {
      "unit": "edge",
      "route": "/install",
      "status": 200,
      "contentClass": "text/x-shellscript",
      "cacheControl": "no-store",
      "workerVersionId": "0e51098f-58b8-418b-8512-29fe67db8032",
      "deploymentLabel": "edge@0e51098f-58b8-418b-8512-29fe67db8032",
      "pass": true
    },
    {
      "unit": "edge",
      "route": "/install.sh",
      "status": 200,
      "contentClass": "text/x-shellscript",
      "cacheControl": "no-store",
      "workerVersionId": "0e51098f-58b8-418b-8512-29fe67db8032",
      "deploymentLabel": "edge@0e51098f-58b8-418b-8512-29fe67db8032",
      "pass": true
    },
    {
      "unit": "edge",
      "route": "/install.ps1",
      "status": 200,
      "contentClass": "text/plain",
      "cacheControl": "no-store",
      "workerVersionId": "0e51098f-58b8-418b-8512-29fe67db8032",
      "deploymentLabel": "edge@0e51098f-58b8-418b-8512-29fe67db8032",
      "pass": true
    },
    {
      "unit": "edge",
      "route": "/download/checksums.txt",
      "status": 200,
      "contentClass": "application/octet-stream",
      "cacheControl": "no-store",
      "workerVersionId": "0e51098f-58b8-418b-8512-29fe67db8032",
      "deploymentLabel": "edge@0e51098f-58b8-418b-8512-29fe67db8032",
      "pass": true
    }
  ]
}
