{
  "schemaVersion": 1,
  "recordId": "production-1-1-0-3f3dedccac12",
  "environment": "production",
  "phase": "deploy",
  "input": {
    "productSha": "3f3dedccac1201bbad6cf231988430550f3b166a",
    "qualificationEvidenceSha": "74ac40c08694d39e6bb9e06845eb3787f1f4bf1e",
    "topology": "candidate-b",
    "units": [
      "docs",
      "edge"
    ]
  },
  "startedAtUtc": "2026-08-16T13:16:43Z",
  "completedAtUtc": "2026-08-16T13:17:00Z",
  "result": "pass",
  "observations": [
    {
      "unit": "docs",
      "route": "/",
      "status": 200,
      "contentClass": "html",
      "cacheControl": "public, max-age=0, must-revalidate",
      "workerVersionId": "8e87121c-9ade-43c8-a7b3-0a4ac9ddd60e",
      "deploymentLabel": "docs@8e87121c-9ade-43c8-a7b3-0a4ac9ddd60e",
      "pass": true
    },
    {
      "unit": "docs",
      "route": "/en/stable/",
      "status": 200,
      "contentClass": "html",
      "cacheControl": "public, max-age=0, must-revalidate",
      "workerVersionId": "8e87121c-9ade-43c8-a7b3-0a4ac9ddd60e",
      "deploymentLabel": "docs@8e87121c-9ade-43c8-a7b3-0a4ac9ddd60e",
      "pass": true
    },
    {
      "unit": "docs",
      "route": "/vi/stable/",
      "status": 200,
      "contentClass": "html",
      "cacheControl": "public, max-age=0, must-revalidate",
      "workerVersionId": "8e87121c-9ade-43c8-a7b3-0a4ac9ddd60e",
      "deploymentLabel": "docs@8e87121c-9ade-43c8-a7b3-0a4ac9ddd60e",
      "pass": true
    },
    {
      "unit": "docs",
      "route": "/llms.txt",
      "status": 200,
      "contentClass": "text/plain",
      "cacheControl": "public, max-age=0, must-revalidate",
      "workerVersionId": "8e87121c-9ade-43c8-a7b3-0a4ac9ddd60e",
      "deploymentLabel": "docs@8e87121c-9ade-43c8-a7b3-0a4ac9ddd60e",
      "pass": true
    },
    {
      "unit": "docs",
      "route": "/docs-bundle.manifest.json",
      "status": 200,
      "contentClass": "application/json",
      "cacheControl": "public, max-age=0, must-revalidate",
      "workerVersionId": "8e87121c-9ade-43c8-a7b3-0a4ac9ddd60e",
      "deploymentLabel": "docs@8e87121c-9ade-43c8-a7b3-0a4ac9ddd60e",
      "pass": true
    },
    {
      "unit": "edge",
      "route": "/version",
      "status": 200,
      "contentClass": "text/plain",
      "cacheControl": "no-store",
      "workerVersionId": "6c62ed0d-4534-41af-bc17-e1f91d4ab304",
      "deploymentLabel": "edge@6c62ed0d-4534-41af-bc17-e1f91d4ab304",
      "pass": true
    },
    {
      "unit": "edge",
      "route": "/install",
      "status": 200,
      "contentClass": "text/x-shellscript",
      "cacheControl": "no-store",
      "workerVersionId": "6c62ed0d-4534-41af-bc17-e1f91d4ab304",
      "deploymentLabel": "edge@6c62ed0d-4534-41af-bc17-e1f91d4ab304",
      "pass": true
    },
    {
      "unit": "edge",
      "route": "/install.sh",
      "status": 200,
      "contentClass": "text/x-shellscript",
      "cacheControl": "no-store",
      "workerVersionId": "6c62ed0d-4534-41af-bc17-e1f91d4ab304",
      "deploymentLabel": "edge@6c62ed0d-4534-41af-bc17-e1f91d4ab304",
      "pass": true
    },
    {
      "unit": "edge",
      "route": "/install.ps1",
      "status": 200,
      "contentClass": "text/plain",
      "cacheControl": "no-store",
      "workerVersionId": "6c62ed0d-4534-41af-bc17-e1f91d4ab304",
      "deploymentLabel": "edge@6c62ed0d-4534-41af-bc17-e1f91d4ab304",
      "pass": true
    },
    {
      "unit": "edge",
      "route": "/download/checksums.txt",
      "status": 200,
      "contentClass": "application/octet-stream",
      "cacheControl": "no-store",
      "workerVersionId": "6c62ed0d-4534-41af-bc17-e1f91d4ab304",
      "deploymentLabel": "edge@6c62ed0d-4534-41af-bc17-e1f91d4ab304",
      "pass": true
    }
  ]
}
